{
  "blocked_by": [],
  "current_task": null,
  "last_event_id": null,
  "project_id": "project/probe-unattended",
  "resume_from": "Claim the lowest-ID ready task from 07_runtime task_runtime.",
  "status": "DRAFT",
  "task_runtime": {
    "initialized_at": "2026-08-21T09:00:00+09:00",
    "tasks": {
      "TASK001": {
        "attempts": 1,
        "depends_on": [],
        "effect_key": "TASK001",
        "failure": null,
        "lease": null,
        "max_attempts": 3,
        "result": {
          "acceptance": [
            "validate --project probe-unattended --check",
            "question count 1"
          ],
          "questions_registered": 1
        },
        "status": "SUCCEEDED",
        "title": "Validate intake and research plan"
      },
      "TASK002": {
        "attempts": 1,
        "depends_on": [
          "TASK001"
        ],
        "effect_key": "TASK002",
        "failure": null,
        "lease": null,
        "max_attempts": 3,
        "result": {
          "acceptance_passed": 4,
          "evidence_added": 2,
          "question": "Q001",
          "search_strategies": 2,
          "sources_reviewed": 2
        },
        "status": "SUCCEEDED",
        "title": "Collect and normalize evidence"
      },
      "TASK003": {
        "attempts": 0,
        "depends_on": [
          "TASK002"
        ],
        "effect_key": null,
        "failure": null,
        "lease": null,
        "max_attempts": 3,
        "result": null,
        "status": "PENDING",
        "title": "Analyze evidence and derive production requirements"
      }
    },
    "version": 1
  },
  "updated_at": "2026-08-21T09:04:24+09:00",
  "version": 1
}
